{
  "schema_version": "1.0",
  "ticket_id": 122,
  "scenario_id": "P03",
  "target_screen": "FrmDetalleClie.aspx",
  "navigation_strategy": "human_path",
  "all_passed": true,
  "elapsed_ms": 57,
  "timestamp": "2026-05-13T15:41:08.272Z",
  "screenshot_path": null,
  "diagnostics": {
    "currentUrl": "http://localhost:35017/AgendaWeb/FrmDetalleClie.aspx",
    "pageTitle": "Detalle de Cliente",
    "aspnetErrorDetected": false,
    "loginRedirectDetected": false,
    "httpStatus": null
  },
  "assertions": [
    {
      "assertion_id": "no_aspnet_error",
      "type": "no_aspnet_error",
      "expected": null,
      "actual": "http://localhost:35017/AgendaWeb/FrmDetalleClie.aspx",
      "passed": true,
      "severity": "hard",
      "category_on_fail": "ENV",
      "selector": null,
      "elapsed_ms": 57,
      "detail": null
    },
    {
      "assertion_id": "no_login_redirect",
      "type": "no_login_redirect",
      "expected": null,
      "actual": "http://localhost:35017/AgendaWeb/FrmDetalleClie.aspx",
      "passed": true,
      "severity": "hard",
      "category_on_fail": "ENV",
      "selector": null,
      "elapsed_ms": 57,
      "detail": null
    },
    {
      "assertion_id": "url_contains_detalle",
      "type": "url_contains",
      "expected": "FrmDetalleClie",
      "actual": "http://localhost:35017/AgendaWeb/FrmDetalleClie.aspx",
      "passed": true,
      "severity": "hard",
      "category_on_fail": "NAV",
      "selector": null,
      "elapsed_ms": 57,
      "detail": null
    }
  ]
}